{
  "ok": true,
  "ticket": {
    "id": 120,
    "title": "RF-007 - Modificaciones en la Lista de Obligaciones",
    "state": "Reviewed by Dev",
    "type": "Task",
    "url": "https://dev.azure.com/UbimiaPacifico/Strategist_Pacifico/_workitems/edit/120"
  },
  "description_md": "<h1>Analisis Funcional - Modificaciones en la Lista de Obligaciones (Pacifico) </h1><p><strong>Fecha de analisis:</strong> 2026-05-05<br><strong>Requerimiento origen:</strong> Epic 118 - RF-007 - Modificaciones en la Lista de Obligaciones<br><strong>Modulos analizados:</strong> RS-AF Agenda WEB_v1 (Barra de Vistas - Obligaciones), RS PACIFICO-AF Agenda WEB_v3 (cambio #9 - Vista Obligaciones Campos adicionales), RS PACIFICO-AF v3 (cambio #7 - Boton Ficha) </p><hr><h2>1. Resumen del requerimiento </h2><p>Pacifico solicita adaptar la pestana Obligaciones de la Barra de Vistas del Detalle de Cliente con dos modificaciones: (1) eliminar la columna Fecha de ingreso judicial (campo estandar inaplicable al modelo asegurador de polizas), y (2) incorporar ocho nuevos campos informativos de solo lectura: Canal de venta, Medio de cobro de ultimo pago, Afiliado al Debito Automatico, Saldo a favor disponible, Cuota, Monto de la Cuota, Nombre del Corredor y Numero de Cuotas. Todos los nuevos campos provienen del proceso de ingesta de posicion batch nocturno y ya estaban pre-identificados en el RS PACIFICO-AF v3 como cambio #9. </p><hr><h2>2. Modulos de UCollect Strategy evaluados </h2><table><tr><th>Modulo</th><th>Archivo</th><th>Relevancia</th></tr><tr><td>Barra de Vistas - pestana Obligaciones </td><td>RS-AF Agenda WEB_v1 </td><td>Pantalla objetivo donde se realizan ambas modificaciones </td></tr><tr><td>Vista Obligaciones - Campos adicionales (cambio #9) </td><td>RS PACIFICO-AF Agenda WEB_v3 </td><td>Pre-identificacion de los 8 nuevos campos como requerimiento Pacifico </td></tr><tr><td>Boton Ficha (cambio #7) </td><td>RS PACIFICO-AF Agenda WEB_v3 </td><td>Referencia cruzada: Afiliado al Debito Automatico tambien figura en cambio #7 </td></tr><tr><td>Datos de Identificacion - Corredor Principal (cambio #4) </td><td>RS PACIFICO-AF Agenda WEB_v3 </td><td>Referencia cruzada: Nombre del Corredor es origen de dato para RF-006 (EP-03) </td></tr><tr><td>Batch nocturno de ingesta de posicion </td><td>RS-AF Agenda WEB_v1 / RS PACIFICO-AF v3 </td><td>Mecanismo de actualizacion de todos los nuevos campos </td></tr></table><hr><h2>3. Analisis de cobertura </h2><h3>3.1 Capacidades actuales de US relevantes </h3><p>La pestana Obligaciones (segunda pestana de la Barra de Vistas del Detalle de Cliente, documentada en RS-AF Agenda WEB_v1, seccion 3.3.1) muestra actualmente la lista de obligaciones del lote con columnas estandar: Obligacion, Producto, Clasificacion, Dias mora, Tipo contrato, Tipo facturacion, Total Vencido, Total a Vencer, Fecha ingreso judicial, Moneda, Sucursal, Fecha vencimiento, Fecha inicio mora, Fecha ultimo pago, Monto ultimo pago y Monto castigo. Los ocho nuevos campos estaban pre-identificados en RS PACIFICO-AF v3 cambio #9. </p><h3>3.2 Gaps o limitaciones detectados </h3><ol><li><strong>Eliminacion de Fecha de ingreso judicial:</strong> campo hardcoded en la vista estandar. No existe mecanismo de configuracion para ocultar columnas individuales por instancia. Requiere desarrollo. </li><li><strong>Ocho nuevos campos:</strong> la lista estandar no incluye ninguno de estos. Requiere verificar modelo de datos, exponer en capa de presentacion y confirmar que batch los alimenta. </li><li><strong>Exclusividad de instancia:</strong> ambas modificaciones deben ser exclusivas de la instancia Pacifico. Se requiere mecanismo de flag de instancia. </li><li><strong>Campo Cuota:</strong> tipo indicado como Texto o Numerico. Se trata como texto para mayor flexibilidad (ver CA-PREGUNTA-01). </li><li><strong>Nulos en Afiliado al Debito Automatico:</strong> comportamiento provisional: mostrar guion cuando valor sea nulo (ver CA-PREGUNTA-02). </li> </ol><hr><h2>4. Clasificacion </h2><blockquote><strong>GAP Menor</strong> - La Vista Obligaciones es una pantalla existente y operativa; los 8 nuevos campos estaban pre-identificados en RS PACIFICO-AF v3 (cambio #9) y los datos provienen de la ingesta batch ya existente. El desarrollo consiste en extender la capa de presentacion de una vista existente con control de visibilidad por instancia, sin nuevos flujos ni modulos.</blockquote><hr><h2>5. Detalle de la clasificacion </h2><p>La Vista Obligaciones es una pantalla plenamente operativa documentada en RS-AF Agenda WEB_v1. Los ocho campos nuevos fueron pre-identificados formalmente en RS PACIFICO-AF v3 (cambio #9). Los datos de origen provienen del batch nocturno de ingesta de posicion ya existente. La eliminacion de la columna es un cambio de visibilidad de campo, no una modificacion del modelo de datos. El patron de exclusividad de instancia Pacifico ya ha sido identificado y abordado en otros GAPs del proyecto (RF-006, GAP02). </p><hr><h2>6. Recomendaciones / Proximos pasos </h2><ol><li>Verificar modelo de datos de ingesta: el AT debe confirmar que los 8 campos ya existen en la tabla Obligaciones tras el batch nocturno. </li><li>Confirmar tipo del campo Cuota: implementar como texto (VARCHAR) mientras tanto. </li><li>Confirmar comportamiento de nulos en Afiliado al Debito Automatico: mostrar guion provisionalmente. </li><li>Reutilizar mecanismo de flag de instancia ya definido para otros GAPs exclusivos de Pacifico. </li><li>Verificar impacto en exportacion si la Vista Obligaciones soporta exportacion. </li><li>Regresion sobre sub-vista de cuotas. </li> </ol><hr><h2>7. Handoff para el Analista Tecnico </h2><p><strong>Sistema afectado:</strong> OnLine + Batch </p><p><strong>Modulo / pantalla principal (sugerido):</strong> Detalle de Cliente - pestana Obligaciones (segunda pestana de la Barra de Vistas) </p><p><strong>Tipo de cambio tecnico esperado:</strong> Desarrollo menor (GAP) </p><p><strong>Keywords tecnicas sugeridas:</strong> VistaObligaciones, PestanaObligaciones, BarraDeVistas, DetalleCliente, FechaIngresoJudicial, OGCORREDOR, CanalVenta, MedioCobroUltimoPago, AfiliadoDebitoAutomatico, SaldoAFavorDisponible, Cuota, MontoCuota, NombreCorredor, NumeroCuotas, batch posicion, ingesta nocturna, flag instancia Pacifico, tenant flag, read-only column, columna oculta, tabla Obligaciones </p><h3>Spec SDD - Criterios de aceptacion (DADO / CUANDO / ENTONCES) </h3><table><tr><th>ID</th><th>DADO</th><th>CUANDO</th><th>ENTONCES</th></tr><tr><td>CA-01 </td><td>Un usuario accede a la instancia Pacifico y abre el Detalle de Cliente de cualquier lote </td><td>Se hace clic en la pestana Obligaciones </td><td>La columna Fecha de ingreso judicial NO aparece en la lista de obligaciones bajo ningun perfil </td></tr><tr><td>CA-02 </td><td>Un usuario accede a la instancia Pacifico y abre la Vista Obligaciones </td><td>Inspecciona las opciones de configuracion de columnas (si existen) </td><td>La columna Fecha de ingreso judicial no figura como opcion seleccionable ni oculta; su eliminacion es definitiva </td></tr><tr><td>CA-03 </td><td>La Vista Obligaciones de Pacifico se carga con un lote que tiene obligaciones con datos completos en el batch </td><td>La lista de obligaciones se renderiza </td><td>Las ocho columnas nuevas aparecen: Canal de venta, Medio de cobro de ultimo pago, Afiliado al Debito Automatico, Saldo a favor disponible, Cuota, Monto de la Cuota, Nombre del Corredor y Numero de Cuotas </td></tr><tr><td>CA-04 </td><td>La Vista Obligaciones de Pacifico muestra un lote con obligaciones </td><td>Se verifica el valor de cada celda de los 8 nuevos campos </td><td>Cada campo muestra el valor cargado por el batch nocturno de ingesta de posicion para esa obligacion especifica </td></tr><tr><td>CA-05 </td><td>Una obligacion no tiene valor informado para uno o mas de los 8 nuevos campos </td><td>La Vista Obligaciones se carga </td><td>La celda del campo sin valor se muestra vacia o con un guion; no se genera error ni excepcion </td></tr><tr><td>CA-06 </td><td>Una obligacion tiene el campo Afiliado al Debito Automatico con valor positivo </td><td>La Vista Obligaciones se carga </td><td>La celda muestra Si </td></tr><tr><td>CA-07 </td><td>Una obligacion tiene el campo Afiliado al Debito Automatico con valor negativo </td><td>La Vista Obligaciones se carga </td><td>La celda muestra No </td></tr><tr><td>CA-08 </td><td>Cualquier usuario (gestor, supervisor, administrador) visualiza la Vista Obligaciones de Pacifico </td><td>Intenta editar cualquiera de los 8 nuevos campos directamente en la lista </td><td>Los campos son de solo lectura; no existe control de edicion habilitado para ningun perfil </td></tr><tr><td>CA-09 </td><td>El campo Saldo a favor disponible tiene un valor monetario positivo para una obligacion </td><td>La Vista Obligaciones se carga </td><td>El valor se muestra con la moneda de la obligacion y el formato numerico configurado para la instancia Pacifico </td></tr><tr><td>CA-10 </td><td>El campo Monto de la Cuota tiene un valor monetario para una obligacion </td><td>La Vista Obligaciones se carga </td><td>El valor se muestra con la moneda de la obligacion y el formato numerico configurado para la instancia Pacifico </td></tr><tr><td>CA-11 </td><td>Un usuario accede a una instancia de UCollect Strategist distinta de Pacifico </td><td>Se carga la pestana Obligaciones del Detalle de Cliente </td><td>Los 8 nuevos campos NO aparecen como columnas; la columna Fecha de ingreso judicial SI aparece (comportamiento estandar) </td></tr><tr><td>CA-12 </td><td>Se ejecuta el batch nocturno de ingesta de posicion con nuevos valores para los campos de las obligaciones </td><td>Al dia siguiente un usuario carga la Vista Obligaciones </td><td>Los 8 nuevos campos reflejan los valores actualizados por el ultimo batch ejecutado </td></tr><tr><td>CA-13 </td><td>La Vista Obligaciones de Pacifico tiene una sub-vista de detalle de cuotas para cada obligacion </td><td>Un usuario selecci